{
  "version": 1,
  "manifestId": "social:linkedin:what-i-learned-building-a-photoshop-in-the-browser:b7eec349dda8",
  "source": {
    "articleSlug": "what-i-learned-building-a-photoshop-in-the-browser",
    "canonicalUrl": "https://davidmieloch.com/blog/what-i-learned-building-a-photoshop-in-the-browser",
    "ledgerPath": "content/distribution/platform-ledger.json",
    "packagePath": "/Users/dmieloch/Documents/codex-worktrees/davidmieloch-site-postiz-callback/content/distribution/social-packages/what-i-learned-building-a-photoshop-in-the-browser/linkedin.md"
  },
  "destination": {
    "platform": "linkedin",
    "accountId": "linkedin",
    "identityLayer": "personal-authority",
    "mode": "draft",
    "postizChannelId": "cmq15vq6n0001my7ovp8dkkne"
  },
  "approval": {
    "status": "missing",
    "approvedBy": "",
    "approvedAt": "",
    "approvalArtifact": ""
  },
  "payload": {
    "text": "What I Learned Building a Photoshop in the Browser\n\nLessons in architecture, state management, and engineering leadership from four years building an enterprise grade design tool. Introduction The Designer Cloud interface — our browser based design platform inspired by Photoshop’s layered editing model. What I Learned Building a Photoshop in the Browser When I first joined the Designer Cloud project at...\n\nRead the canonical essay: https://davidmieloch.com/blog/what-i-learned-building-a-photoshop-in-the-browser?utm_source=linkedin&utm_medium=social&utm_campaign=factory_content_pipeline&utm_content=what-i-learned-building-a-photoshop-in-the-browser",
    "links": [
      "https://davidmieloch.com/blog/what-i-learned-building-a-photoshop-in-the-browser"
    ],
    "media": []
  },
  "safety": {
    "safeDefault": "do-not-post",
    "credentialCustodyVerified": false,
    "deletePathKnown": false,
    "publicExposureGateAnswered": true,
    "refusalInboxPath": "content/distribution/refusal-inbox.json"
  },
  "signature": {
    "algorithm": "sha256",
    "digest": "96ec9c758cc23aabf052d9a12c6d220c568e3c2539b1f77d1dc90e9e4a6fd199"
  }
}
