{
  "version": 1,
  "manifestId": "social:linkedin:the-ai-bill-you-cant-predict:afdac7730dd2",
  "source": {
    "articleSlug": "the-ai-bill-you-cant-predict",
    "canonicalUrl": "https://davidmieloch.com/blog/the-ai-bill-you-cant-predict",
    "ledgerPath": "content/distribution/platform-ledger.json",
    "packagePath": "/Users/dmieloch/Documents/codex-worktrees/davidmieloch-site-postiz-callback/content/distribution/social-packages/the-ai-bill-you-cant-predict/linkedin.md"
  },
  "destination": {
    "platform": "linkedin",
    "accountId": "linkedin",
    "identityLayer": "personal-authority",
    "mode": "draft",
    "postizChannelId": "cmq15vq6n0001my7ovp8dkkne"
  },
  "approval": {
    "status": "missing",
    "approvedBy": "",
    "approvedAt": "",
    "approvalArtifact": ""
  },
  "payload": {
    "text": "The AI Bill You Can't Predict\n\nThe AI Bill You Can't Predict There's a conversation happening in every enterprise right now about AI costs. It usually goes are these costs worth it? What's the ROI? How do we justify the spend? Those are the right questions. But there's a prior question most organizations aren't asking do you actually understand what you're paying for? Not the headline...\n\nRead the canonical essay: https://davidmieloch.com/blog/the-ai-bill-you-cant-predict?utm_source=linkedin&utm_medium=social&utm_campaign=factory_content_pipeline&utm_content=the-ai-bill-you-cant-predict",
    "links": [
      "https://davidmieloch.com/blog/the-ai-bill-you-cant-predict"
    ],
    "media": []
  },
  "safety": {
    "safeDefault": "do-not-post",
    "credentialCustodyVerified": false,
    "deletePathKnown": false,
    "publicExposureGateAnswered": true,
    "refusalInboxPath": "content/distribution/refusal-inbox.json"
  },
  "signature": {
    "algorithm": "sha256",
    "digest": "06aae48c9a308a04e0c3da90a529b5399c32e6bb409d1a6ddbd0e4e506af4f1f"
  }
}
