{
  "version": 1,
  "manifestId": "social:linkedin:why-character-choice-matters-in-agent-design:a95b3de70e1a",
  "source": {
    "articleSlug": "why-character-choice-matters-in-agent-design",
    "canonicalUrl": "https://davidmieloch.com/blog/why-character-choice-matters-in-agent-design",
    "ledgerPath": "content/distribution/platform-ledger.json",
    "packagePath": "/Users/dmieloch/Documents/codex-worktrees/davidmieloch-site-postiz-callback/content/distribution/social-packages/why-character-choice-matters-in-agent-design/linkedin.md"
  },
  "destination": {
    "platform": "linkedin",
    "accountId": "linkedin",
    "identityLayer": "personal-authority",
    "mode": "draft",
    "postizChannelId": "cmq15vq6n0001my7ovp8dkkne"
  },
  "approval": {
    "status": "missing",
    "approvedBy": "",
    "approvedAt": "",
    "approvalArtifact": ""
  },
  "payload": {
    "text": "Why Character Choice Matters in Agent Design\n\nMost people assume that giving an AI agent a fictional persona is just for fun. A novelty. A skin on top of the real system. I've found the opposite. Personas carry serious engineering weight, and the people dismissing them are probably underestimating what a single character name actually invokes. The Training Data Shortcut When you name an agent after a...\n\nRead the canonical essay: https://davidmieloch.com/blog/why-character-choice-matters-in-agent-design?utm_source=linkedin&utm_medium=social&utm_campaign=factory_content_pipeline&utm_content=why-character-choice-matters-in-agent-design",
    "links": [
      "https://davidmieloch.com/blog/why-character-choice-matters-in-agent-design"
    ],
    "media": []
  },
  "safety": {
    "safeDefault": "do-not-post",
    "credentialCustodyVerified": false,
    "deletePathKnown": false,
    "publicExposureGateAnswered": true,
    "refusalInboxPath": "content/distribution/refusal-inbox.json"
  },
  "signature": {
    "algorithm": "sha256",
    "digest": "549e234daf3ec4b4277f0f77a9e043817653e1b4d8da13eddda36a1c536b6cc0"
  }
}
