{
  "version": 1,
  "manifestId": "social:linkedin:why-you-should-encapsulate-your-javascript-conditionals-in-a-function:0298f2f71f98",
  "source": {
    "articleSlug": "why-you-should-encapsulate-your-javascript-conditionals-in-a-function",
    "canonicalUrl": "https://davidmieloch.com/blog/why-you-should-encapsulate-your-javascript-conditionals-in-a-function",
    "ledgerPath": "content/distribution/platform-ledger.json",
    "packagePath": "/Users/dmieloch/Documents/codex-worktrees/davidmieloch-site-postiz-callback/content/distribution/social-packages/why-you-should-encapsulate-your-javascript-conditionals-in-a-function/linkedin.md"
  },
  "destination": {
    "platform": "linkedin",
    "accountId": "linkedin",
    "identityLayer": "personal-authority",
    "mode": "draft",
    "postizChannelId": "cmq15vq6n0001my7ovp8dkkne"
  },
  "approval": {
    "status": "missing",
    "approvedBy": "",
    "approvedAt": "",
    "approvalArtifact": ""
  },
  "payload": {
    "text": "Why you should Encapsulate your Javascript Conditionals in a Function\n\nConditional statements are a crucial aspect of programming but can often be challenging to read and understand. They tend to be long and detailed, including multiple edge cases that might not be relevant while scanning the code. This makes it difficult for developers to understand the flow of the program and what the conditional statement is doing. One way...\n\nRead the canonical essay: https://davidmieloch.com/blog/why-you-should-encapsulate-your-javascript-conditionals-in-a-function?utm_source=linkedin&utm_medium=social&utm_campaign=factory_content_pipeline&utm_content=why-you-should-encapsulate-your-javascript-conditionals-in-a-function",
    "links": [
      "https://davidmieloch.com/blog/why-you-should-encapsulate-your-javascript-conditionals-in-a-function"
    ],
    "media": []
  },
  "safety": {
    "safeDefault": "do-not-post",
    "credentialCustodyVerified": false,
    "deletePathKnown": false,
    "publicExposureGateAnswered": true,
    "refusalInboxPath": "content/distribution/refusal-inbox.json"
  },
  "signature": {
    "algorithm": "sha256",
    "digest": "ae7268a2c02a6379f6c7b93063bd485dad0d444df38a621b4b7d6b04b51f792c"
  }
}
