{
  "version": 1,
  "manifestId": "social:linkedin:the-overnight-shift:b3ce3941d3f2",
  "source": {
    "articleSlug": "the-overnight-shift",
    "canonicalUrl": "https://davidmieloch.com/blog/the-overnight-shift",
    "ledgerPath": "content/distribution/platform-ledger.json",
    "packagePath": "/Users/dmieloch/Documents/codex-worktrees/davidmieloch-site-postiz-callback/content/distribution/social-packages/the-overnight-shift/linkedin.md"
  },
  "destination": {
    "platform": "linkedin",
    "accountId": "linkedin",
    "identityLayer": "personal-authority",
    "mode": "draft",
    "postizChannelId": "cmq15vq6n0001my7ovp8dkkne"
  },
  "approval": {
    "status": "missing",
    "approvedBy": "",
    "approvedAt": "",
    "approvalArtifact": ""
  },
  "payload": {
    "text": "The Overnight Shift\n\nWhat happens when your code keeps working after you go to bed. I launched an execution engine on a Saturday evening and went to have dinner. When I came back, it was still running. When I went to bed, it was still running. When I woke up Sunday morning, it had completed 40% of a migration plan and hit a problem it couldn't solve without me. I made tea, read...\n\nRead the canonical essay: https://davidmieloch.com/blog/the-overnight-shift?utm_source=linkedin&utm_medium=social&utm_campaign=factory_content_pipeline&utm_content=the-overnight-shift",
    "links": [
      "https://davidmieloch.com/blog/the-overnight-shift"
    ],
    "media": []
  },
  "safety": {
    "safeDefault": "do-not-post",
    "credentialCustodyVerified": false,
    "deletePathKnown": false,
    "publicExposureGateAnswered": true,
    "refusalInboxPath": "content/distribution/refusal-inbox.json"
  },
  "signature": {
    "algorithm": "sha256",
    "digest": "dc79a24e07553dc791bead56cb15d696e96ff0a46db388de2fa0779fac7ef014"
  }
}
