{
  "version": 1,
  "manifestId": "social:linkedin:the-ai-cost-rug-pull-isnt-a-bubble-its-a-filter:0bc5a44dbfc1",
  "source": {
    "articleSlug": "the-ai-cost-rug-pull-isnt-a-bubble-its-a-filter",
    "canonicalUrl": "https://davidmieloch.com/blog/the-ai-cost-rug-pull-isnt-a-bubble-its-a-filter",
    "ledgerPath": "content/distribution/platform-ledger.json",
    "packagePath": "/Users/dmieloch/Documents/codex-worktrees/davidmieloch-site-postiz-callback/content/distribution/social-packages/the-ai-cost-rug-pull-isnt-a-bubble-its-a-filter/linkedin.md"
  },
  "destination": {
    "platform": "linkedin",
    "accountId": "linkedin",
    "identityLayer": "personal-authority",
    "mode": "draft",
    "postizChannelId": "cmq15vq6n0001my7ovp8dkkne"
  },
  "approval": {
    "status": "missing",
    "approvedBy": "",
    "approvedAt": "",
    "approvalArtifact": ""
  },
  "payload": {
    "text": "A lot of people are reading the AI cost jump as a bubble popping.\n\nI think that misses the point.\n\nThe cheap phase was the training period. The next phase is the filter: who can still build when the bill starts behaving like physics instead of marketing?\n\nRead the canonical essay: https://davidmieloch.com/blog/the-ai-cost-rug-pull-isnt-a-bubble-its-a-filter?utm_source=linkedin&utm_medium=social&utm_campaign=factory_content_pipeline&utm_content=the-ai-cost-rug-pull-isnt-a-bubble-its-a-filter",
    "links": [
      "https://davidmieloch.com/blog/the-ai-cost-rug-pull-isnt-a-bubble-its-a-filter"
    ],
    "media": []
  },
  "safety": {
    "safeDefault": "do-not-post",
    "credentialCustodyVerified": false,
    "deletePathKnown": false,
    "publicExposureGateAnswered": true,
    "refusalInboxPath": "content/distribution/refusal-inbox.json"
  },
  "signature": {
    "algorithm": "sha256",
    "digest": "b551aea6e1c69d65f1a88e21e3032849fccd32b83cf32dbf1fec686c74393dbe"
  }
}
